{
  "version": "1",
  "id": "utilitaria",
  "label": "Utilitaria (Ops/Industrial)",
  "cssVars": {
    "--bg-deep-void": "#0b1221",
    "--text-sovereign-gold": "#e5e7eb",
    "--accent-neural-cyan": "#22c55e",
    "--glass-border": "rgba(148, 163, 184, 0.22)",
    "--glass-bg": "rgba(11, 18, 33, 0.72)",
    "--text-primary": "#f8fafc",
    "--text-secondary": "#cbd5e1",
    "--font-family": "system-ui, -apple-system, Segoe UI, Roboto, Arial, sans-serif"
  },
  "assets": {
    "heroBgId": "bg.utilitaria.hero"
  }
}

