{
  "version": "1",
  "id": "accoglienza",
  "label": "Accoglienza (Care/Trust)",
  "cssVars": {
    "--bg-deep-void": "#0b1221",
    "--text-sovereign-gold": "#fbbf24",
    "--accent-neural-cyan": "#60a5fa",
    "--glass-border": "rgba(96, 165, 250, 0.22)",
    "--glass-bg": "rgba(11, 18, 33, 0.72)",
    "--text-primary": "#f8fafc",
    "--text-secondary": "#d1d5db",
    "--font-family": "system-ui, -apple-system, Segoe UI, Roboto, Arial, sans-serif"
  },
  "assets": {
    "heroBgId": "bg.accoglienza.hero"
  }
}

