{
  "version": "1",
  "id": "fuoriserie",
  "label": "Fuoriserie (Luxury/Executive)",
  "cssVars": {
    "--bg-deep-void": "#07070a",
    "--text-sovereign-gold": "#d4af37",
    "--accent-neural-cyan": "#93c5fd",
    "--glass-border": "rgba(212, 175, 55, 0.18)",
    "--glass-bg": "rgba(7, 7, 10, 0.72)",
    "--text-primary": "#f8fafc",
    "--text-secondary": "#cbd5e1",
    "--font-family": "system-ui, -apple-system, Segoe UI, Roboto, Arial, sans-serif"
  },
  "assets": {
    "heroBgId": "bg.fuoriserie.hero"
  }
}

