{
  "version": "1",
  "id": "easyway-arcane",
  "label": "EasyWay (Arcane)",
  "cssVars": {
    "--bg-deep-void": "#050912",
    "--text-sovereign-gold": "#f0cf78",
    "--accent-neural-cyan": "#12d6c8",
    "--glass-border": "rgba(240, 207, 120, 0.25)",
    "--glass-bg": "rgba(5, 9, 18, 0.78)",
    "--text-primary": "#f4f7fa",
    "--text-secondary": "#a9b4c6",
    "--font-family": "system-ui, -apple-system, Segoe UI, Roboto, Arial, sans-serif"
  },
  "assets": {
    "heroBgId": "bg.arcane.hero"
  }
}
